object_id,title,featured,creator,description,source_url,period,year,medium_genre,subjects,source,credit,thumbnail,alt_text
id_objeto,titulo,destacado,creador,descripcion,url_fuente,periodo,año,medio_genero,temas,fuente,credito,miniatura,texto_alt
# Make it lower-case and avoid spaces. If you are referring to a local object please ensure the object_id matches the name of the file exactly (with or without the file extension – it doesn't matter).,# Please provide a title — this is required.,"# Describe what the image shows for screen readers. Mention the subject and key details. Avoid ""Image of..."" — describe the content directly. If empty, the title is used.","# Mark ""yes"" to feature on homepage",# The person or organization that created the original object.,"# A brief description of the object, shown on the objects page of your published site.",# Here you can include a IIIF manifest and Telar will do the rest of the work for you.,"# The historical period this object belongs to (e.g. ""Colonial period"", ""19th century"").",# In YYYY format — for filtering and sorting chronologically.,"# The medium or genre of the object (e.g. ""Map"", ""Photograph"", ""Engraving"").",# Comma-separated terms for gallery filtering,"# This will be overlaid over the viewer, unless you specify otherwise in _config.yml.","# Attribution line shown on the published site (e.g. ""Courtesy of UCSB Library"").","# Telar generates thumbnails automatically, but you can override this by specifying an image file in this column."
"# Escríbelo en minúsculas y sin espacios. Si hace referencia a un objeto local, asegúrate de que el object_id coincida exactamente con el nombre del archivo (con o sin extensión; no importa).",# Incluye un título: este campo es obligatorio.,"# Describe lo que muestra la imagen para lectores de pantalla. Menciona el sujeto y los detalles clave. Evita ""Imagen de..."" — describe el contenido directamente. Si se deja vacío, se usa el título.","# Marca ""sí"" para destacar en la página de inicio",# La persona u organización que creó el objeto original.,"# Una breve descripción del objeto, que se muestra en la página de objetos de tu sitio publicado.",# Aquí puedes incluir un manifiesto IIIF y Telar se encargará del resto del trabajo.,"# El período histórico al que pertenece este objeto (por ejemplo, ""Período colonial"", ""Siglo XIX"").",# En formato AAAA — para filtrar y ordenar cronológicamente.,"# El medio o género del objeto (por ejemplo, ""Mapa"", ""Fotografía"", ""Grabado"").",# Términos separados por comas para filtrado de galería,"# Esto se mostrará encima del visor, a menos que indiques lo contrario en _config.yml.","# Línea de atribución que se muestra en el sitio publicado (por ejemplo, ""Cortesía de la Biblioteca de UCSB"").","# Telar genera miniaturas automáticamente, pero puedes anular este comportamiento especificando un archivo de imagen en esta columna."
44-2,Digital Care and Collective Effort,,Dongyu Jiang,"A photograph capturing a collaborative group study and project development session at UCSB, focusing on team effort and digital content creation.",,2026,2026,,,,,,"Three male students are collaborating in a modern university workshop space. Two students are seated at a white desk, with one actively typing on a dark laptop while the other watches closely. A third student stands behind them, leaning forward to look at the screen. The background features a grid whiteboard and office shelves."
20260524-145131,Collective Devotion at Storke Plaza,,Dongyu Jiang,"A wide-shot photograph capturing the student community gathering at UCSB's Plaza on May 20, 2026, creating an intentional emotional connection under academic stress.",,2026,2026,,,,,,"A massive crowd of college students gathered at night in an outdoor plaza at UCSB. Looming palm trees flank the foreground, framing a giant illuminated concrete carillon tower under a dark sky. The crowd is dense, standing together in a quiet, unified formation within the open campus space."
20260527-224527,Sunset Fellowship: Peer Friendship and Community Care as Forms of Daily Love,,Dongyu Jiang,"The photograph portrays a calm expression of romantic friendship and love of community in UCSB’s common environment. While academic pressure increases, students choose to meet in the grassland by the coast to talk, cycle, and enjoy each other’s company in the evening time. The informal relationship serves as an important expression of interpersonal love, which helps overcome fear and anxiety in the environment.",,,,,,,,,Sunset Fellowship: Peer Friendship and Community Care as Forms of Daily Love